City Name,Brand/Store Name,No. of Outlets,Full Address,Latitude,Longitude,Pincode,Area,Timing,isMall,MallName
,,,"RCity Mall, Shop No F61-62, 1st Floor, Phase-II, LBS Marg, Ghatkopar West, Mumbai, Maharashtra 400086",19.1001839,72.916658,400086,,,TRUE,RCity Mall
,,,"Shop No 4 To 10, Rukhasana Terrace, Dr Babasaheb Ambedkar Road, Opposite Parel Railway Work Shop, Parel, Mumbai, Maharashtra 400012",19.0015698,72.8363795,400012,,,FALSE,
,,,"Shop NO. 8&9, Hemandra Society, Gokhale Rd, Naupada, Thane West, Thane, Maharashtra 400602",19.187524,72.9711384,400602,,,FALSE,
,,,"Sion - Trombay Rd, Chembur East, Postal Colony, Chembur, Mumbai, Maharashtra 400071",19.0540463,72.8928691,400071,,,FALSE,
,,,"Viviana Mall,, Thane West, Eastern Express Hwy, Thane, Maharashtra 400610",19.2088139,72.9713387,400610,,,TRUE,Viviana Mall
,,,"Ground floor Raghulela Mall, Sector 30, Vashi, Navi Mumbai, Maharashtra 400703",19.0638681,72.9969051,400703,,,TRUE,Ground floor Raghulela Mall
,,,"Sant Savata Mali Marg, Byculla East, Byculla, Mumbai, Maharashtra 400027",18.9762894,72.838512,400027,,,FALSE,
,,,"Mathura Kunj, Shop No. 1 & 2, Near, Maxus Mall Rd, Bhayandar West, Mira Bhayandar, Maharashtra 401101",19.295186,72.8466484,401101,,,TRUE,Maxus Mall Rd
,,,,,,,,,,
,Wrangler,7,"1st Floor,R City Mall, Amrut Nagar Rd, Amrut Nagar, Ghatkopar West, Mumbai, Maharashtra 400086",19.0996854,72.9163939,400086,,,TRUE,R City Mall
,,,"Shop G - 64, Lal Bahadur Shastri Rd, Patelwadi.Kurla, Kamani, Ashok Nagar, Saki Naka, Mumbai, Maharashtra 400072",19.085022,72.886619,400072,,,FALSE,
,,,"Infiniti Mall, Mindspace, Malad West, Mumbai, Maharashtra 400064",19.1848469,72.8345642,400064,,,TRUE,Infiniti Mall
,,,"FF-47, Pokharan Rd Number 2, Laxmi Nagar, Thane West, Thane, Maharashtra 400606",19.2083715,72.9711686,400606,,,FALSE,
,,,"Shope No -22, Seawood Grand Central Mall, Sector 40, Nerul, Navi Mumbai, Maharashtra 400706",19.0218844,73.0185706,400706,,,TRUE,Seawood Grand Central Mall
,,,"Nerul East, Sector 40, Nerul, Navi Mumbai, Maharashtra 400706",19.0211554,73.0146996,400706,,,FALSE,
,,,"X4V8+87F, Forest Colony, Panvel, Navi Mumbai, Maharashtra 410206",18.9933125,73.1156719,410206,,,FALSE,
,,,,,,,,,,
,Zara,5,"Ground Floor 9, 10, 11, 12, Oberoi Mall, Western Express Hwy, Goregaon, Mumbai, Maharashtra 400063",19.1739027,72.8611028,400063,,,TRUE,Oberoi Mall
,,,"s/n, Veer Nariman Road, Kala Ghoda, Fort, Mumbai, Maharashtra 400001",18.9322474,72.8326143,400001,,,FALSE,
,,,"Infiniti Mall II, New Link Rd, Malad West, Mumbai, Maharashtra 400064",19.1848469,72.8345642,400064,,,TRUE,Infiniti Mall II
,,,"high street phoenix, 462, Senapati Bapat Marg, Mumbai, Maharashtra 400013",18.994744,72.8245993,400013,,,FALSE,
,,,"Eastern Express Hwy, Laxmi Nagar, Thane West, Thane, Maharashtra 400601",19.2085425,72.9728673,400601,,,FALSE,
,,,,,,,,,,
,Ziwame ,7,"Unit No.SF124A, First Floor Infiniti Mall 1406 A, 16E, New Link Rd, Mindspace, Malad West, Mumbai, Maharashtra 400064",19.1848469,72.8345642,400064,,,TRUE,First Floor Infiniti Mall 1406 A
,,,"R City Mall, Unit No SF 14, Second Floor, Lal Bahadur Shastri Rd, Amrut Nagar, Ghatkopar West, Mumbai, Maharashtra 400086",19.0996854,72.9163939,400086,,,TRUE,R City Mall
,,,"Shop No. FF - 19, Lal Bahadur Shastri Rd, Kamani, Kurla West, Kurla, Mumbai, Maharashtra 400070",19.0863795,72.8889774,400070,,,FALSE,
,,,"Unit no FF 18, First floor,R Mall (Thane, Ghodbunder Rd, opp. Lokim Company, Dokali Pada, Dhokali, Thane West, Thane, Maharashtra 400607",19.2305798,72.9773622,400607,,,TRUE,R Mall (Thane
,,,"Shop No 532, Kadamb Kudpi House, Next to MC Donalds Linking Road, Vithalbhai, Patel Road, Mumbai, Maharashtra 400052",19.065984,72.8344177,400052,,,FALSE,
,,,"Zivame Unit No SF04A, Second Floor, Viviana Mall, Pokharan Rd Number 2, next to Jupiter Hospital, Subhash Nagar, Thane, Maharashtra 400606",19.2087445,72.971562,400606,,,TRUE,Viviana Mall
,,,"Unit no F-30-S -H, Nerul East, Sector 40, Nerul, Navi Mumbai, Maharashtra 400706",19.0211554,73.0146996,400706,,,FALSE,
,,,,,,,,,,
,Zodiac,19,"Oberoi Mall, First Floor -23, Western Express Hwy, Goregaon, Mumbai, Maharashtra 400063",19.173725,72.8605168,400063,,,TRUE,Oberoi Mall
,,,"G-1-7, Ground Floor, Grand Hayat Shopping Plaza, Santacruz East, Mumbai, Maharashtra 400055",19.0767582,72.8512645,400055,,,FALSE,
,,,"Inorbit Mall, Shop No.G43, Ground Floor, New Link Rd, Mindspace, Malad West, Mumbai, Maharashtra 400064",19.1729281,72.8359056,400064,,,TRUE,Inorbit Mall
,,,"Shop No. 262 L.T.Marg, Craw Ford Market, opp. G.T. Hospital, Mumbai, Maharashtra 400002",18.945892,72.831315,400002,,,FALSE,
,,,"Shop UG 98, Lal Bahadur Shastri Rd, Kamani, Kurla West, Kurla, Mumbai, Maharashtra 400070",19.0863795,72.8889774,400070,,,FALSE,
,,,"G1 Ground floor British gas Hous, Lake Blvd Rd, Hiranandani Gardens, Powai, Mumbai, Maharashtra 400076",19.1195476,72.9080234,400076,,,FALSE,
,,,"Jay Villa, GROUND FLOOR, B-1& B-3, Linking Rd, Santacruz West, Mumbai, Maharashtra 400054",19.0812246,72.8341696,400054,,,FALSE,
,,,"Shop No. 5, Cr2 Mall, opp. bajaj bhawan, Nariman Point, Mumbai, Maharashtra 400021",18.9265907,72.8226526,400021,,,TRUE,Cr2 Mall
,,,"Shetty House Opp.Mumbai University 101 M.G. Rd Fort, Near Kandil, Rest, Mumbai, Maharashtra 400001",18.9302716,72.8314756,400001,,,FALSE,
,,,"Store No, 58/A, Lal Bahadur Shastri Rd, Amrut Nagar, Ghatkopar West, Mumbai, Maharashtra 400086",19.0929806,72.912243,400086,,,FALSE,
,,,"Anuradha Building, Manek Nagar, Maharashtra Nagar, Borivali West, Mumbai, Maharashtra 400092",19.2306925,72.8530164,400092,,,FALSE,
,,,"TT, Dr. Baba Saheb Ambedkar Rd, Opp. Babubhai Jagjivandas, Dadar, Mumbai, Maharashtra 400014",19.0163905,72.8471086,400014,,,FALSE,
,,,"High Street Phoenix, G-13, Senapati Bapat Marg, Lower Parel, Mumbai, Maharashtra 400013",18.9947636,72.8236607,400013,,,FALSE,
,,,"Security Hold Area (SHA, Terminal 2, Chatrapati Shivaji International Airport, (CSIA) Shop No. 64 Level -4, Andheri East, Mumbai, Maharashtra 400099",19.0903694,72.8627519,400099,,,FALSE,
,,,"Phoenix Marketcity, Lal Bahadur Shastri Rd, Kurla West, Mumbai, Maharashtra 400072",19.0863795,72.8889774,400072,,,FALSE,
,,,"Shop 3, 31st Road, Opp.Shoppers Stop, Bandra West, Mumbai, Maharashtra 400050",19.0612031,72.8356398,400050,,,FALSE,
,,,"Sri Krishna Premises Co-Op. Society Ltd, New Link Road Andheri (West), Mumbai – 400 053, Mumbai, Maharashtra 400053",19.1405123,72.8319683,400053,,,FALSE,
,,,"Napeansea Road, Near Priyadarshini Park, opp. Russian Consulate, Mumbai, Maharashtra 400006",18.9570417,72.7996174,400006,,,FALSE,
,,,"Taj Mahal Intercontinental, Shopping Arcade, Apollo Bandar, Mumbai, Maharashtra 400001",18.9225854,72.8331543,400001,,,FALSE,
,,,,,,,,,,
,Zudio,13,"Star Bazaar, Crystal Point, Off New Link Road, Andheri West, Mumbai, Maharashtra 400053",19.1309003,72.8308621,400053,,,FALSE,
,,,"Brijwasi Excellentia, Sonawala Rd, Sonawala Industry Estate, Goregaon, Mumbai, Maharashtra 400063",19.1619282,72.851349,400063,,,FALSE,
,,,"Pranay Nagar CHS, Yashprabha, Kastur Park Rd, Shimpoli, Borivali West, Mumbai, Maharashtra 400092",19.2263045,72.8434373,400092,,,FALSE,
,,,"Manpada, Thane West, Thane, Maharashtra 400607",19.2308277,72.9741067,400607,,,FALSE,
,,,"Tembhi Naka, Tembhi Naka, Dhobi Ali, Charai, Thane West, Thane, Maharashtra 400601",19.1977664,72.9761365,400601,,,FALSE,
,,,"Prabhat Plaza, Shivaji Path, opp. MLD High school, Jambli Naka, Thane West, Thane, Maharashtra 400601",19.1904706,72.9766035,400601,,,FALSE,
,,,"Hiranandani Meadows, Emerald Plaza, Block no 4, 1 st floor, 102 & 103, Gladys alvares road, Pokharan Rd Number 2, Thane West, Maharashtra 400610",19.2200423,72.9701969,400610,,,FALSE,
,,,"Shreeji Tower, Star Market, Aarambh, near Mc donald, Mira Road, Mumbai, Maharashtra 401107",19.2883164,72.8678225,401107,,,FALSE,
,,,"Plot No 02, Mahavir Astha, Sector 07, Kharghar, Navi Mumbai, Maharashtra 410210",19.0370087,73.062637,410210,,,FALSE,
,,,"Bhumi Pinnacle, Building, Roadpali, Kalamboli, Panvel, Navi Mumbai, Maharashtra 400706",19.0359653,73.1020887,400706,,,FALSE,
,,,"Gold Crest 369, opp. New Viva college, Y K Nagar, Virar West, Virar, Maharashtra 401303",19.4599511,72.8004351,401303,,,FALSE,
,,,"Capital Mall, Lower Ground Floor, Yashvant Viva Twp, Nalasopara East, Mumbai, Maharashtra 401209",19.4076665,72.8219649,401209,,,TRUE,Capital Mall
,,,"Dominos Pizza Corner, Bus Depot, Konark Arcade, Agra Rd, Bhiwandi, Maharashtra 421308",19.2993673,73.0650915,421308,,,FALSE,
,,,,,,,,,,
,Decathalon,7,"Trishul Goldmine, 1st Floor, 04, Palm Beach Rd, Sector 15, CBD Belapur, Navi Mumbai, Maharashtra 400614",19.0119509,73.0347387,400614,,,FALSE,
,,,"No.2, Ground Floor, Link Palace, Linking Rd, Santacruz West, Mumbai, Maharashtra 400054",19.0777081,72.8346362,400054,,,FALSE,
,,,"Level 1 Big Shopping Center, Ghodbunder Rd, Kasarvadavali, Gaon, Thane, Maharashtra 400615",19.2681929,72.9650586,400615,,,FALSE,
,,,"Piramal Realty, Agastya Corporate Park, Kamani Junction, Sunder Baug Ln, Mumbai, Maharashtra 400070",19.085318,72.886434,400070,,,FALSE,
,,,"Peninsula Towers, Thakur Mall, Dahisar East, Ground Floor, Ketkipada, Dahisar East, Mumbai, Maharashtra 401107",19.2635013,72.8748725,401107,,,TRUE,Thakur Mall
,,,"Atria-The Millennium Mall, Dr Annie Besant Rd, next to Royal Garden, Lotus Colony, Worli, Mumbai, Maharashtra 400018",18.9910033,72.8143227,400018,,,TRUE,Atria-The Millennium Mall
,,,"F-18B, 1st Floor, South Wing R-City MAll, Lal Bahadur Shastri Rd, opp. Godrej, Ghatkopar West, Mumbai, Maharashtra 400086",19.0999066,72.9153934,400086,,,TRUE,
,,,,,,,,,,
,Daniel Wellington ,8,"Ground floor, Infiniti mall, New Link Rd, Phase D, Oshiwara, Andheri West, Mumbai, Maharashtra 400053",19.1412127,72.8309064,400053,,,TRUE,
,,,"R City Mall, Lal Bahadur Shastri Rd, Amrut Nagar, Ghatkopar West, Mumbai, Maharashtra 400086",19.0996854,72.9163939,400086,,,TRUE,R City Mall
,,,"Unit UG, 31, Lal Bahadur Shastri Rd, Kamani, Kurla West, Kurla, Mumbai, Maharashtra 400070",19.0863795,72.8889774,400070,,,FALSE,
,,,"Infiniti Mall, New Link Road, Malad (west Unit no GF042, Mumbai, Maharashtra 400064",19.1848469,72.8345642,400064,,,TRUE,Infiniti Mall
,,,"G-14, Grand west zone-west Main Avenue High Street Phoenix, Senapati Bapat Marg, Lower Parel, Mumbai, Maharashtra 400013",18.994744,72.8245993,400013,,,FALSE,
,,,"Ground floor, Infiniti mall, New Link Rd, Phase D, Oshiwara, Andheri West, Mumbai, Maharashtra 400053",19.1412127,72.8309064,400053,,,TRUE,
,,,"Seawood railway station, Navi Mumbai, Seawoods Station Rd, Seawoods West, Sector 40, Nerul, Navi Mumbai, Maharashtra 400706",19.0218844,73.0185706,400706,,,FALSE,
,,,"Seawoods Grand Central Mall, Level UG,Seconds, Nerul, Navi Mumbai, Maharashtra 400614",19.0218844,73.0185706,400614,,,TRUE,Seawoods Grand Central Mall
,,,,,,,,,,
,Casio,7,"No G42, Ground Floor, Inorbit Mall, New Link Rd, next to Hypercity, Malad, Mumbai, Maharashtra 400064",19.1729281,72.8359056,400064,,,TRUE,Inorbit Mall
,,,"Lal Bahadur Shastri Rd, opposite Naaz Hotel, Kamani, Kurla West, Kurla, Mumbai, Maharashtra 400070",19.0845704,72.8891072,400070,,,FALSE,
,,,"Just Lifestyle Pvt. Ltd. ,Unit No.G-10 B, Palladium, Hight Street Phoenix, Senapati Bapat Marg, Lower Parel, Mumbai, Mumbai, Maharashtra 400013",18.994744,72.8245993,400013,,,FALSE,
,,,"Infiniti Mall, New Link Rd, Malad, Mindspace, Goregaon West, Mumbai, Maharashtra 400064",19.1848469,72.8345642,400064,,,TRUE,Infiniti Mall
,,,"Unit No 18, Viviana Mall, Pokharan Rd Number 1, next to Jupiter Hospital, Subhash Nagar, Thane, Maharashtra 400606",19.2087646,72.9716953,400606,,,TRUE,Viviana Mall
,,,"Inorbit Mall(India) Pvt. Ltd, Malad, Mindspace, Malad West, Mumbai, Maharashtra 400064",19.1730327,72.8356308,400064,,,TRUE,Inorbit Mall(India) Pvt. Ltd
,,,"F 51/52, 1st Floor, Seawood Mall Nerul Node, Sector 40, Navi Mumbai, Maharashtra 400706",19.0218844,73.0185706,400706,,,TRUE,Seawood Mall Nerul Node
,,,,,,,,,,
,Fossil,9,"Shop G - 33, Western Express Hwy, Yashodham, Goregaon, Mumbai, Maharashtra 400063",19.235989,72.862902,400063,,,FALSE,
,,,"Chhatrapati Shivaji International Airport Area, Vile Parle, Mumbai, Maharashtra 400099",19.0903694,72.8627519,400099,,,FALSE,
,,,"G-07, New Link Rd, Malad, Mindspace, Malad West, Mumbai, Maharashtra 400064",19.1730932,72.835889,400064,,,FALSE,
,,,"UG -13/14,Phoenix Market City, Lalbahadur Shastri Rd, Kurla West, Mumbai, Maharashtra 400070",19.0863795,72.8889774,400070,,,FALSE,
,,,"R City Mall, Shop No. G 70A, Ground, Lal Bahadur Shastri Rd, Amrut Nagar, Ghatkopar West, Mumbai, Maharashtra 400086",19.0993558,72.9163421,400086,,,TRUE,R City Mall
,,,"Dr Annie Besant Rd, Lower Parel, Mumbai, Maharashtra 400013",18.9992156,72.8171977,400013,,,FALSE,
,,,"Ground Floor, Viviana Mall, Unit No.GF, 68, Eastern Express Hwy, beside Jupiter Hospital, Thane West, Mumbai, Maharashtra 400606",19.2087175,72.9715119,400606,,,TRUE,Viviana Mall
,,,"Shop no G-33, Oberoi Mall, Oberoi Garden City, Off, Western Express Hwy, Dindoshi, Goregaon, Mumbai, Maharashtra 400063",19.173725,72.8605168,400063,,,TRUE,Oberoi Mall
,,,"Biba - Chhatrapati shivaji International Airport, Terminal 2, RFP-20, Level 3, Sahar, Mumbai, Maharashtra 400099",19.0974373,72.8745017,400099,,,FALSE,
,,,,,,,,,,
,Lavie,8,"Unit F - 13, Lal Bahadur Shastri Rd, Kamani, Kurla West, Kurla, Mumbai, Maharashtra 400070",19.0744461,72.8758034,400070,,,FALSE,
,,,"Shopper's Stop, Malad, Malad West, Mumbai, Maharashtra 400064",19.1756702,72.8324764,400064,,,FALSE,
,,,"Navpada, Vile Parle East, Vile Parle, Mumbai, Maharashtra 400099",19.0963781,72.8563994,400099,,,FALSE,
,,,"Amrut Nagar Cir, Amrut Nagar, Ghatkopar West, Mumbai, Maharashtra 400086",19.1013148,72.9115554,400086,,,FALSE,
,,,"Viviana mall, Eastern Express Hwy, Thane West, Maharashtra",19.2088139,72.9713387,,,,TRUE,
,,,"Ground Floor, Shop No. G- 15B, L.B.S Marg, Ghatkopar (W), Mumbai, 400086",19.0867759,72.8980867,400086,,,FALSE,
,,,"Unit No.FF-46A, Level First, Viviana Mall, Pokharan Rd Number 2, next to Jupiter Hospital, Subhash Nagar, Thane, Maharashtra 400606",19.2087646,72.9716953,400606,,,TRUE,Viviana Mall
,,,"F-07, Seawoods Station Rd, Sector 40, Nerul, Navi Mumbai, Maharashtra 400706",19.0218844,73.0185706,400706,,,FALSE,
,,,,,,,,,,
,Tanishq,17,"Extension of Entry road to Phoenix, Lower Parel, Mumbai, Maharashtra 400013",18.993734,72.8243796,400013,,,FALSE,
,,,"No. 7, Brabourne, stadium, Veer Nariman Road, opp. Ambassador Hotel, Churchgate, Mumbai, Maharashtra 400020",18.9337167,72.8247998,400020,,,FALSE,
,,,"Vastu Prestige, Off New Link Road, near Citi Mall, Andheri (W, Mumbai, Maharashtra 400053",19.1374591,72.8313417,400053,,,TRUE,near Citi Mall
,,,"Lal Bahadur Shastri Rd, Amrut Nagar, Ghatkopar West, Mumbai, Maharashtra 400086",19.0991894,72.9173925,400086,,,FALSE,
,,,"Post Security Check In, Domestic Departures, Terminal 2, Chatrapati Shivaji Internation Airport, Andheri (E, Mumbai, Maharashtra 400069",19.0903694,72.8627519,400069,,,FALSE,
,,,"36, Rotunda, Shop No. 4, 5, 6 Opp. Crossword, Turner Rd, near Tavaa Restaurant, Bandra West, Mumbai, Maharashtra 400050",19.0592624,72.835211,400050,,,FALSE,
,,,"Oberoi, Showroom F-24, Unit G-2, Oberoi Mall Pvt Ltd, Off, Western Express Hwy, Yashodham, Goregaon, Mumbai, Maharashtra 400063",19.173725,72.8605168,400063,,,TRUE,Oberoi Mall Pvt Ltd
,,,"Ground Floor Plot No. 159 A, Mahalaxmi Heritage, Central Ave Rd, near Ambedkar Circle, Chembur, Mumbai, Maharashtra 400071",19.0591901,72.9003297,400071,,,FALSE,
,,,"Ground Floor Inorbit Mall, New Link Rd, Malad West, Mumbai, Maharashtra 400064",19.1729281,72.8359056,400064,,,TRUE,Ground Floor Inorbit Mall
,,,"Tanishq, near Benetton, Linking Rd, Santacruz West, Mumbai, Maharashtra 400052",19.0773802,72.8347005,400052,,,FALSE,
,,,"Sai Darshan Building, Swami Vivekananda Rd, opp. Fire Station, Navpada, Irla, Andheri West, Mumbai, Maharashtra 400058",19.1121145,72.8416789,400058,,,FALSE,
,,,"Vini Eligence Building, Ground Floor, L.T.Road, Borivali West, Mumbai, Maharashtra 400092",19.2284246,72.8525995,400092,,,FALSE,
,,,"Ground Floor, Interlink House, Mahatma Gandhi Rd, Near Satyam Shopping Center, Neelkhanth Valley, Ghatkopar East, Mumbai, Maharashtra 400077",19.0760143,72.9033425,400077,,,FALSE,
,,,"UG- 47, Ground Floor, Phoenix Market City, Lal Bahadur Shastri Rd, Kurla, Mumbai, Maharashtra 400070",19.0863795,72.8889774,400070,,,FALSE,
,,,"Shop No.9, R Square Gr. Floor, Lal Bahadur Shastri Rd, Mulund West, Mumbai, Maharashtra 400080",19.1802501,72.9462904,400080,,,FALSE,
,,,"Ice Factory, No. 1 & 2, Hoshbanno Mansion Opp. Old, Gokhale Rd, Naupada, Thane West, Thane, Maharashtra 400602",19.187351,72.968884,400602,,,FALSE,
,,,"Viviana Mall, Unit No 8, Ground Floor, Pokharan Rd Number 2, next to Jupiter Hospital, Subhash Nagar, Thane West, Mumbai, Maharashtra 400610",19.206394,72.9571961,400610,,,TRUE,Viviana Mall
,,,"K N Bldg, Opp Asthika Samaj, Bhandarkar Rd, near Maheshwari Udyan, Matunga, Mumbai, Maharashtra 400019",19.0275123,72.854062,400019,,,FALSE,
,,,,,,,,,,
,World of Titan,18,"Shop No. 2 & 3, Jai Shiv Shakti Building, Nehru Road, Mulund (West), Mumbai, Maharashtra 400080",19.167693,72.951391,400080,,,FALSE,
,,,"378, N C. Kelkar Rd, opposite Dadar Emporium, Near Kabutar khana, Dadar West, Dadar, Mumbai, Maharashtra 400028",19.0201557,72.8411616,400028,,,FALSE,
,,,"G-1 & G-2, 199 Linking Road Diagonally Opp. Shoppers Stop Navchandra Niwas Co-Operative, Bandra West, Mumbai, Maharashtra 400050",19.067328,72.833886,400050,,,FALSE,
,,,"Silverstone Building, 294, Linking Rd, Khar West, Mumbai, Maharashtra 400052",19.0739327,72.8344466,400052,,,FALSE,
,,,"F-28, Western Express Hwy, Yashodham, Goregaon, Mumbai, Maharashtra 400063",19.1740643,72.8600069,400063,,,FALSE,
,,,"Shop No.1 & 2 Mehul Building, L.T.Road, Near Diamond Theater, Borivali (West, Gorai 1, Borivali, Mumbai, Maharashtra 400092",19.2289595,72.8537403,400092,,,FALSE,
,,,"Shop No.164-B, Chickhal House, Ground Floor, Marine Line East, Shamaldas Gandhi Marg, Joshi Wadi, Kalbadevi, Mumbai, Maharashtra 400002",18.9466247,72.8290687,400002,,,FALSE,
,,,"Natraj Theatre Building,, Ground Floor,, Road No.1,, Chembur, Mumbai, Maharashtra 400071",19.0624743,72.8992222,400071,,,FALSE,
,,,"Ground Floor,High Street Phoenix Mall,North Sky Zone, Lower Parel, Mumbai, Maharashtra 400013",18.9948509,72.8252115,400013,,,TRUE,High Street Phoenix Mall
,,,"Station Road, Borivali East, Mumbai, Maharashtra 400066",19.1874125,72.8472944,400066,,,FALSE,
,,,"Shop No 2, Jamuna Apartment, Swami Vivekananda Rd, opp. Shoppers Stop, Andheri West, Mumbai, Maharashtra 400058",19.1144127,72.8428963,400058,,,FALSE,
,,,"Viviana Mall, Groud Floor, Shop No G - 61, Eastern Express Hwy, Mumbai, Maharashtra 400601",19.2088342,72.9715561,400601,,,TRUE,Viviana Mall
,,,"Unit No W5-3104, Level 3, Terminal T2,, Chhatrapati Shivaji International Airport, Domestic Departure,Santacruz (East),, Mumbai, Maharashtra 400099",19.0984636,72.8744401,400099,,,FALSE,
,,,"D Joshi Marg, LIC Colony, Suresh Colony, Vile Parle West, Mumbai, Maharashtra 400056",19.1001609,72.842583,400056,,,FALSE,
,,,"Abdul Rehman St, Mumbadevi Area, Bhuleshwar, Mumbai, Maharashtra 400003",18.9523358,72.8322617,400003,,,FALSE,
,,,"Korum Mall, Thane West, Mumbai, Maharashtra 400606",19.2028031,72.9653798,400606,,,TRUE,Korum Mall
,,,"Holland House, Shahid Bhagat SIngh Marg, Colaba,, Maharashtra 400039",18.9238431,72.8316746,400039,,,FALSE,
,,,"15, Heera Panna Shopping Centre, Haji Ali, Mumbai, Maharashtra 400026",18.9773774,72.8105606,400026,,,FALSE,
,,,,,,,,,,
,Swarovski ,9,"Unit No F7, First Floor, Senapati Bapat Marg, Parel, Mumbai, Maharashtra 400013",18.9942103,72.8242535,400013,,,FALSE,
,,,"2, New Link Rd, Malad, Reserve Bank of India Staff Quarters, Raheja Twp, Kandivali West, Mumbai, Maharashtra 400104",19.1731757,72.8354983,400104,,,FALSE,
,,,"International Departure, Terminal 2, Chhatrapati Shivaji International Airport, International Airport, Sahar, Sahar Elevated Rd, Mumbai, Maharashtra",19.0903694,72.8627519,,,,FALSE,
,,,"Store No. G-20, Infiniti Mall, New Link Rd, Malad West, Mumbai, Maharashtra 400064",19.1848469,72.8345642,400064,,,TRUE,Infiniti Mall
,,,"UG 15, Lal Bahadur Shastri Rd, Kamani, Kurla West, Kurla, Mumbai, Maharashtra 400070",19.0863795,72.8889774,400070,,,FALSE,
,,,"231, Link Corner Building, Shop No.3, Linking Road, Mumbai, Maharashtra 400050",19.0603028,72.836316,400050,,,FALSE,
,,,"Ground floor, Vivana Mall, Pokharan Rd Number 2, next to Jupiter Hospital, Thane, Laxmi Nagar, Thane West, Thane, Maharashtra 400610",19.2097096,72.9723931,400610,,,TRUE,Vivana Mall
,,,"R City Mall, ground floor, swarovski store, 1, Lal Bahadur Shastri Rd, Amrut Nagar, Ghatkopar West, Mumbai, Maharashtra 400086",19.0993716,72.9161062,400086,,,TRUE,R City Mall
,,,"Unit UG - 61, Seawoods Station Rd, Seawoods West, Nerul East, Sector 40, Nerul, Navi Mumbai, Maharashtra 400706",19.0218844,73.0185706,400706,,,FALSE,
,,,,,,,,,,
,Aldo,6,"No.G086, Ground Floor, Next To Croma, Infinity Mall, New Link Rd, Mindspace, West, Mumbai, Maharashtra 400064",19.184917,72.8342272,400064,,,TRUE,Infinity Mall
,,,"Unit UG, 2, Lal Bahadur Shastri Rd, Kurla, Mumbai, Maharashtra 400072",19.0718351,72.8751093,400072,,,FALSE,
,,,"G - 4, New Link Rd, Malad, Mindspace, Malad West, Mumbai, Maharashtra 400064",19.1729281,72.8359056,400064,,,FALSE,
,,,"Viviana Mall, Eastern Express Hwy, Laxmi Nagar, Thane West, Thane, Maharashtra 400606",19.2088139,72.9713387,400606,,,TRUE,Viviana Mall
,,,"Shop Number 71 /72, Plot Number R 1, Seawoods Grand Central, Sector 40, Nerul, Navi Mumbai, Maharashtra 400706",19.0218844,73.0185706,400706,,,FALSE,
,,,"Vatsala Linking Road Vatsala, Linking Rd, opp. ICICI Bank, Santacruz, Mumbai, W, Mumbai, Maharashtra 400054",19.0758833,72.834604,400054,,,FALSE,
,,,,,,,,,,
,American Tourister,4,"Lal Bahadur Shastri Rd, opp. Dreams Mall, Bhandup, Valmik Nagar, Bhandup West, Mumbai, Maharashtra 400078",19.1458308,72.9355006,400078,,,TRUE,opp. Dreams Mall
,,,"Lower, Parel, Mumbai, Maharashtra 400013",18.9982461,72.8269646,400013,,,FALSE,
,,,"4V75+PM7, Andheri East, Mumbai, Maharashtra 400053",19.1142875,72.8591719,400053,,,FALSE,
,,,"Shop No.5-6, Ground Floor, Opposite Vijay Sales, Mira Bhayandar Road Chhatrapati, Shivaji Maharaj Marg, Silver Park, Mira Road, Mumbai, Maharashtra 401107",19.2812391,72.8748753,401107,,,FALSE,
,,,,,,,,,,
,Baggit,12,"Linking Rd, opposite McDonald's, Bandra West, Mumbai, Maharashtra 400050",19.0660073,72.8345042,400050,,,FALSE,
,,,"Unit No.SF-239, 2nd Floor, Infiniti Mall, Link Road, Malad West, Mumbai, Maharashtra 400064",19.1848469,72.8345642,400064,,,TRUE,Infiniti Mall
,,,"Balkrishna Niwas, 11 C. Rly, Matunga Rd, Mumbai, Maharashtra 400019",19.0258644,72.850394,400019,,,FALSE,
,,,"Shree Krishna Sadan, 175, Kurla(West, Lal Bahadur Shastri Rd, Patelwadi.Kurla, Kamani, Ashok Nagar, Kurla, Mumbai, Maharashtra 400070",19.0825827,72.8825143,400070,,,FALSE,
,,,"F Wing, Dr Annie Besant Rd, Shiv Sagar Estate, Worli, Mumbai, Maharashtra 400018",18.9905278,72.8135081,400018,,,FALSE,
,,,"Phoenix market city, Kurla, Mumbai, Maharashtra 400070",19.0863795,72.8889774,400070,,,FALSE,
,,,"Palm Beach Rd, Sector 30A, Vashi, Navi Mumbai, Maharashtra 400703",19.0664269,73.0018314,400703,,,FALSE,
,,,"5, Dinshaw Petit Rd, Shree Ganesh Nagar, Lal Baug, Parel, Mumbai, Maharashtra 400012",18.9900976,72.8382549,400012,,,FALSE,
,,,"310, Marve Rd, Malad, Reserve Bank of India Staff Quarters, Raheja Twp, Malad East, Mumbai, Maharashtra 400064",19.1931075,72.8407194,400064,,,FALSE,
,,,"Viviana mall, Unit No. FF 36A,1st Floor Voltas compound, Pokhran Rd. No. 2, Eastern Express Hwy, Subhash Nagar, Thane West, Mumbai, Maharashtra 400606",19.2087175,72.9715119,400606,,,TRUE,
,,,"Shop no-G77, Ground Floor, Lal Bahadur Shastri Marg, Ghatkopar West, Mumbai, Maharashtra 400086",19.0995674,72.9155966,400086,,,FALSE,
,,,"Seawoods Station Rd, Nerul East, Sector 28, Nerul, Navi Mumbai, Maharashtra 400706",19.021679,73.0170403,400706,,,FALSE,
,,,,,,,,,,
,Charles & Keith,8,"Lal Bahadur Shastri Rd, Kurla West, Kurla, Mumbai, Maharashtra 400070",19.0723864,72.8756851,400070,,,FALSE,
,,,"Unit 35, Ground Floor, Infiniti Mall, New Link Rd, Malad West, Mumbai, Maharashtra 400064",19.1412127,72.8309064,400064,,,TRUE,Infiniti Mall
,,,"462, Senapati Bapat Marg, Lower Parel West, Lower Parel, Mumbai, Maharashtra 400013",18.9948342,72.8246722,400013,,,FALSE,
,,,"Mumbai, Amrut Nagar, Ghatkopar West, Mumbai, Maharashtra 400086",19.1020767,72.9128351,400086,,,FALSE,
,,,"New Link Rd, Malad, Malad West, Mumbai, Maharashtra 400064",19.1889341,72.8354551,400064,,,FALSE,
,,,"Store No. 19, Viviana Mall, Eastern Express Hwy, Laxmi Nagar, Thane West, Thane, Maharashtra 400606",19.2087175,72.9715119,400606,,,TRUE,Viviana Mall
,,,"Shop Number 27 Plot number R 1 Upper ground floor Grand Centers Sawoods Railway Station, Sector 40, Seawoods, Navi Mumbai, Maharashtra 400706",19.0218844,73.0185706,400706,,,FALSE,
,,,"11, P Tandon Rd, Phase D, Highland Park, Andheri West, Mumbai, Maharashtra 400053",19.1412889,72.8310453,400053,,,FALSE,
,,,,,,,,,,
,Clarks,9,"Building No 59, R City Mall, Lal Bahadur Shastri Rd, Ghatkopar West, Mumbai, Maharashtra 400086",19.0996854,72.9163939,400086,,,TRUE,R City Mall
,,,"Senapati Bapat Marg, Lower Parel, Mumbai, Maharashtra 400013",18.9999654,72.828525,400013,,,FALSE,
,,,"Inorbit Rd, Malad, Mindspace, Goregaon West, Mumbai, Maharashtra 400104",19.1729157,72.8360088,400104,,,FALSE,
,,,"C/O SSIPL Lifestyle Pvt. Ltd. Shop No. F-49 First Floor Inorbit Mall, Malad West, Mumbai, Maharashtra 400064",19.1729281,72.8359056,400064,,,TRUE,Inorbit Mall
,,,"CSIA Domestic Terminal Chhatrapati Shivaji International Airport Terminal 2, Navpada, Area, Vile Parle, Mumbai, Maharashtra 400082",19.0974373,72.8745017,400082,,,FALSE,
