City Name,Brand/Store Name,No. of Outlets,Full Address,Latitude,Longitude,Pincode,Area,Timing,isMall,MallName
,,,,,,,,,,
Mumbai,Shopper's Stop,9,"D/211, S V Road, Andheri (West), Mumbai 400058",19.1150743,72.8426492,400058,Andheri(West),,FALSE,
,,,"C/O Khandelwal Estates, Old Bandra Talkies, Linking Road, Bandra (West), 400050",19.061234,72.836207,400050,Bandra(West),,FALSE,
,,,"Krushal Commercial Centre, G M Road, Chembur(West), Mumbai 400089",19.0697853,72.9003827,400089,Chembur(West),,FALSE,
,,,"Unit G/70, F53, S64 R City Mall, LBS Marg, Ghatkopar (West), 400086",19.0996854,72.9163939,400086,Ghatkopar(West),11am–9:30pm,FALSE,
,,,"B/Eureka Towers, 9th Floor, Mindspace, Link Road, Malad (West), 400064",19.1800469,72.8342861,400064,Malad(West),11am–10pm,FALSE,
,,,"InOrbit Mall, Plot A/1406, 28/A, Link Road, Malad (West), 400064",19.1729281,72.8359056,400064,Malad(West),11am–10pm,TRUE,
,,,"Nirmal Lifestyles LBS Marg, Mulund (West), 400080",19.1656026,72.9351217,400080,Mulund(West),11am–9pm,FALSE,
,,,"Unit G/A2 and F/A2, Inorbit Mall, Plot 39/1, Vashi, Navi Mumbai, 400705",19.0657994,73.0009493,400705,Navi,11am–10pm,TRUE,Inorbit Mall
,,,"Dynamix Mall, Y J Reality Ltd, Sant Dhyaneshwar Marg, JVPD Scheme, Near Chandan Cinema Hall, Vile Parle (West), 400049",19.1146403,72.8274212,40049,Vile Parle(West),11am–9:30pm,TRUE,Dynamix Mall
,,,,,,,,,,
,Brand Factory,11,"Times Square , Andheri-Kurla Road , Marol Village ,Andheri East ,Mumbai -400059",19.1080069,72.8837132,400059,Andheri East,11am–9:30pm,FALSE,
,,,"Helix-3, Old Shreyas Cinema, Lal Bahadur Shastri Rd, Near Vijay Sales, Sainath Nagar, Ghatkopar West, Mumbai, Maharashtra 400086",19.094055,72.9128515,40086,Ghatkopar West,11am–9pm,FALSE,
,,,"Umang Towers, Mindspace Complex, Behind Inorbit Mall ,Off Malad Link Road ,Malad West,Mumbai-400064",19.1756702,72.8324763,400064,Malad West,11am–9:30pm,TRUE,Mindspace Complex
,,,"Raghuleela Mall, Opposite Vashi Station, Sector 30, Vashi, Navi Mumbai, Maharashtra 400703",19.0638681,72.9969051,400703,Navi,11am–9:30pm,TRUE,Raghuleela Mall
,,,"Dattani Cube, Bhabola Chulna Rd, Next To Big Bazaar, Papdi, Vasai West, Vasai-Virar, Maharashtra 401201",19.3601141,72.812594,401201,Vasai West,11am–9:30pm,FALSE,
,,,"Space 912, Mira Bhayandar Rd, Opp. Pleasant Park, Thane, Maharashtra 401107",19.2786366,72.8795634,401107,Thane,11am–9:30pm,FALSE,
,,,"Cross Road, Tardeo Rd, Near Tardeo Ac Market, Mumbai, Maharashtra 400034",18.9757537,72.81213,40034,,11am–9:30pm,FALSE,
,,,"Mahavir Nagar, V Souk, Opp. Kamla Sports Club, Sector 10, Kandivali West, Mumbai, Maharashtra 400067",19.212978,72.842562,400067,Kandivali West,11am–9:30pm,FALSE,
,,,"R Mall, 1St Floor, Ghodbunder Service Rd, Dokali Pada, Manpada, Thane West, Thane, Maharashtra 400607",19.2305798,72.9773622,400607,Thane,Temporarily Closed,TRUE,R Mall
,,,"Framjee Cawasjee Institute, Opposite Metro Cinema, Dhobi Talao, Marine Lines, Mumbai, Maharashtra 400002",18.94351,72.828598,400002,Marine Lines,11am–9:30pm,FALSE,
,,,"Kalyan- Sarvodaya Mall,Sarvodaya Mall Shilphata Road, Near Patri Pool, Kalyan, Maharashtra 421301",19.2347201,73.1223287,421301,Kalyan,11am–9:30pm,TRUE,Kalyan - Sarvodaya Mall
,,,,,,,,,,
,Westside,11,"102 - Cosmos Plaza, Jp Road, D.N.Nagar, Andheri West, Mumbai - 400053",19.1286745,72.829833,400053,Andheri West,10:30am–8:30pm,TRUE,Cosmos Plaza
,,,"Army Navy Building, Kala Ghoda, 148, Mahatma Gandhi Marg, Fort, Mumbai - 400001",18.927993,72.830923,400001,Kala Ghoda,10:30am–8:30pm,FALSE,
,,,"Kohinoor Square-Dadar, N. C. Kelkar Marg, R. G. Gadkari Chowk, Shivaji Park, Dadar(West)",19.0249221,72.8415036,,Dadar(West),10am–6pm,FALSE,
,,,"Phoenix Market City, Lal Bahadur Shastri Rd, Kamani, Kurla West",19.0863795,72.8889774,,Kurla WEst,11am–9pm,FALSE,
,,,"Gold Crest Building, Gf & FF - Opp Manubhai Jewelers, L T Road, Nr. Railway Stn., Borivali (W)",19.2291309,72.8523105,,Borivali,10:30am–8:30pm,FALSE,
,,,"67, Ground Floor - Lalbahadur Shastri Road, Amrut Nagar, Ghatkopar West",19.0991894,72.9173925,,Ghatkopar West,11am–9:30pm,FALSE,
,,,"Inifiniti Mall 2, Ground Floor, Unit No 001 Survey No.504 - New Link Road, Near D-Mart, Rajan Pada, Malad West, Mumbai - 400064",19.1848469,72.8345642,400064,Malad West,12am–9pm,TRUE,Inifiniti
,,,Next to Courtyard by Marriott,36.1139293,-95.8929364,,,,FALSE,
,,,"Level 01, Haiko Mall, Central Avenue, Hiranandani Gardens, Powai, Mumabi - 400076",19.1181532,72.9111783,400076,Powai,11am–9pm,TRUE,Haiko Mall
,,,"Infiniti Mall Near Raheja Classic Complex Oshiwara - Phase D, Shastri Nagar, Andheri West",19.1412127,72.8309064,,Andheri West,11am–9pm,TRUE,Infinity Mall
,,,"39 N. S. Patkar Marg, Opp. Dalvi - Hospital, Mumbai - 400007",18.9587045,72.810431,400007,,10:30am–9:30pm,FALSE,
,,,,,,,,,,
,Pantaloons,21,"G-10 & F9a, Metro Junction Mall, Village Netivali, Shil Road, Kalyan - 421306",19.2296376,73.1234003,421306,Kalyan,11am–9:30pm,TRUE,Metro Junction Mall
,,,"Viviana Mall, Cadbury Junction, Eastern Express Highway, Besides Jupiture Hospital, Thane-West 400601",19.2085718,72.9717188,400601,Thane West,10am–8pm,TRUE,Viviana Mall
,,,"Runwal Mall, Opp. Richardson Cruddas Factory, Lbs Marg, Mulund (West) Mumbai -400080",19.1839411,72.9516935,400080,Mulund(West),11am–9:30pm,TRUE,Runwal Mall
,,,"Pantaloons, Infinity Mall, Shop No 103, Near D-Mart, New Link Road, Malad West",19.1848469,72.8345642,,Malad West,11am–9:30pm,TRUE,Infinity Mall
,,,"Darvesh Horizon, Next To Thakur Mall, Western Express Highway, Dahisar Check Post, Dahisar East, Mumbai",19.2618702,72.872981,,Dahisar East,10am–10pm,FALSE,
,,,"Unit No. 262-263, Ii Floor, Link Road, Oshiwara, Andheri W, Mumbai – 400053",19.141266,72.830948,400053,Andheri West,11am–10pm,FALSE,
,,,"Phoenix Market City Kurla Kaveri Estate , L B S Road, Kurla(W) Mumbai-400070",19.0863795,72.8889774,400070,Kurla West,11am–9pm,FALSE,
,,,"Pantaloons, Growel?S 101 Mall, Akruli Road, Kandivali East, Mumbai- 400060",19.2030154,72.859757,400060,Kandivali East,11am–10pm,FALSE,
,,,"L&T Mall, Plot R1, Sector 40, Seawoods Railway Station, Nerul Node, Navi Mumbai – 400706",19.0218844,73.0185706,400706,Navi,11am–10pm,TRUE,L&T Mall
,,,"Sri Vallabh Shopping Centre Sv Road, Near Flyover, Borivali (W) Mumbai-400092",19.2239304,72.8538839,400092,Borivali West,11am–9pm,FALSE,
,,,"Maxus Mall, Ff, Temba Road, Near New Flyover Bridge, Bhayander West, Thane – 401101",19.2956732,72.8487124,401101,NBhayander West,11am–10pm,TRUE,Maxus Mall
,,,"Xperia Mall, Gf, Palava City, Dombivali, Thane, Maharashtra – 421204",19.1654748,73.0750684,421204,Thane West,11am–10pm,TRUE,Xperia Mall
,,,"Pantaloons Woman, Little World Mall, Shop No. 120, Ff, Plot No. 21, Sector-2, Kharghar, Navi Mumbai – 410210",19.0306551,73.0664059,410210,Navi,10:30am–10pm,TRUE,Little World Mall
,,,"Pantaloons Kids, Star Mall, Nc Kelkar Road, Opp Plaza Cinema, Dadar",19.0229667,72.8419961,,Dadar,10:30am–9pm,TRUE,Star Mall
,,,"K-Star Mall, Store No. 3, 4, 5 & 6, First Floor, Diamond Garden, Chembur",19.0521416,72.9014469,,Chembur,11am–10pm,TRUE,K - Star Mall
,,,"R City Mall, F18c, Lbs Marg, Ghatkopar",19.0996854,72.9163939,,Ghatkopar,10am–9pm,TRUE,R City Mall
,,,"Shop No. 2, Beau Pride, Hill Road, Mumbai -400050",19.0551613,72.8324834,400050,,11am–9pm,FALSE,
,,,"The Capital By Lake Shore, Gf: 02a, 02b And Ff: 01,25,26, Survey No 52 & 53, At New Link Road, Nallasopara East, Vasai",19.1898861,72.8354552,,Vasai,,FALSE,
,,,"Ground Floor Siddhi Arcade Narangi Bypass Road, V K Nagar Virar (West) 401303",19.4621373,72.8049913,401303,,10am–4pm,FALSE,
,,,"Kohinoor Square, N.C Kelkar Marg, R.G Gadkari Chowk, Shivaji Park, Dadar (W), Mumbai",19.024923,72.8415047,,Dadar West,11am–10pm,FALSE,
,,,"Ff, Sf & Ff, High Street Phoenix, North Skyzone Senapati Bapat Marg Lower Parel",18.9948509,72.8252115,,,11am–10pm,FALSE,
,,,,,,,,,,
,Max,13,"Lower Ground Floor, City Mall Phoneix Market, Lal Bahadur Shastri Rd, Kamani, Kurla West, Mumbai, Maharashtra 400070",19.0863795,72.8889774,400070,Kurla West,11am–10pm,FALSE,
,, ,"Parle Square Mall, Agarwal Market, Vile Parle (E),",19.1002164,72.845686,,Vile Parle East,10:30am–4pm,TRUE,Parle Square Mall
,,,"Infiniti Mall, Unit No SF201A, 1st Floor, New Link Rd, Malad West, Mumbai, Maharashtra 400064",19.1848469,72.8345642,400064,Malad West,10:30am–10pm,TRUE,Infiniti Mall
,,,"Star Mall, 1st Floor, N C. Kelkar Rd, Dadar West, Mumbai, Maharashtra 400028",19.0228207,72.8419935,400028,Dadar West,10:30am–10pm,TRUE,Star
,,,"BN Agarwal Commercial Complex, 1st & 2nd Flr, Parle Square Mall, Monghibai Rd, Navpada, Vile Parle East, Mumbai, Maharashtra 400057",19.1002164,72.845686,400057,Vile Parle East,10:30am–4pm,TRUE,BN Agarwal Commercial Comples
,,,"Max Retail Devision, R City Mall, No F 39, 1st Floor, Lal Bahadur Shastri Rd, Phase 2, Mumbai, 400086",19.1005564,72.9164804,400086,,10:30am–4pm,TRUE,R City Mall
,,,"1st & 2nd Flr, Growels 101 Mall Western Express Hwy, Akurli Rd, near Police Station, Samata Nagar, Mumbai, Maharashtra 400101",19.2033444,72.8595734,400101,,11am–10pm,FALSE,
,,,"1st Floor, R Mall, Mulund Check Naka, Mulund East, Mumbai, Maharashtra 400080",19.1840208,72.9513545,400080,Mulund East,10:30am–10pm,TRUE,R Mall
,,,"R-Mall, Ghodbunder Road, Thane (W)",19.2305798,72.9773622,,Thane West,10:30am–10pm,TRUE,R Mall
,,,"Service Rd, Laxmi Nagar, Thane West, Thane, Maharashtra 400601",19.2019866,72.9663611,4000601,Thane ,10:30am–10pm,FALSE,
,,,"Inorbit Mall, No F9 & F10, 1st Floor, Palm Beach Rd, Sector 30A, Vashi, Navi Mumbai, Maharashtra 400705",19.0657994,73.0009493,400705,Navi,10:30am–10pm,TRUE,Inorbit
,,,"Sector 40, Nerul, Navi Mumbai, Maharashtra 400706",19.0211554,73.0146996,400706,Navi Mumbai,11am–10pm,FALSE,
,,,"Saat Rasta, Mahalakshmi, Mumbai, Maharashtra 401101",18.9807362,72.8265158,401101,,10:30am–10pm,FALSE,
,,,,,,,,,,
,Lifestyle,7,"Phoenix Palladium, Senapati Bapat Marg, Lower Parel, Mumbai, Maharashtra 400013",18.994744,72.8245993,400013,Lower Parel,11am–10pm,FALSE,
,,,"UG - 45, Phoenix Market City, Lal Bahadur Shastri Rd, Kurla, Mumbai, Maharashtra 400077",19.0863795,72.8889774,400077,Kurla,11am–9:30pm,FALSE,
,,,"Oberoi Mall, Western Express Hwy, Goregaon, Mumbai, Maharashtra 400063",19.173808,72.8605943,400063,Goregaon,11am–9:30pm,TRUE,Oberoi
,,,"Bus Depot, R City Mall LBS Marg, Ghatkopar West, near Vikhroli, Mumbai, Maharashtra 400086",19.0996854,72.9163939,400086,Ghatkopar West,,TRUE,R City Mall
,,,"No 639, Runwal Arcade, Lal Bahadur Shastri Rd, Mulund West, Mumbai, Maharashtra 400080",19.172488,72.9409454,400080,Mulund West,,FALSE,
,,,"Senapati Bapat Marg, Upper Worli, Lower Parel, Mumbai, Maharashtra 400013",18.9908892,72.8236391,400013,Lower Parel,,FALSE,
,,,"Shri Sevantilal Khandwala Marg, Malad, Asmita Jyoti Housing Society, Malad West, Mumbai, Maharashtra 400064",19.1962878,72.8274679,400064,Malad West,,FALSE,
,,,,,,,,,,
,Central,4,"Goregaon Central OBEROI MALL International Business Park near OBEROI GARDEN CITY, Yashodham, Goregaon, Mumbai, Maharashtra 400063",19.173725,72.8605168,400063,Goregaon,,TRUE,Geregaon Central OBEROI MALL
,,,"261, Aarey Rd, Peru Baug, Jay Prakash Nagar, Goregaon, Mumbai, Maharashtra 400063",19.1662478,72.8513399,400063,Goregaon,,FALSE,
,,,"Kandivali Central Growel's 101 Mall, Akurli Road, Off, Western Express Hwy, Mumbai, Maharashtra 400101",19.2033444,72.8595734,400101,,,TRUE,Kandivali Central Growel's Mall
,,,"43, Colaba Causeway, Badhwar Park, Apollo Bandar, Colaba, Mumbai, Maharashtra 400005",18.9175662,72.8277277,400005,Colaba,,FALSE,
,,,,,,,,,,
,Accessorize,8,"Waterfield Road, Khar, Khar West, Mumbai, Maharashtra 400050",19.0622039,72.8344933,400050,Khar West,,FALSE,
,,,"Unit UG - 63, Lal Bahadur Shastri Rd, Patelwadi.Kurla, Kamani, Kurla West, Kurla, Mumbai, Maharashtra 400070",19.0869923,72.8897252,400070,Kurla West,,FALSE,
,,,"T20B, Palladium Mall, Senapati Bapat Marg, Lower Parel, Mumbai, Maharashtra 400013",18.9947953,72.8245836,400013,Lower Parel,,TRUE,Palladium Mall
,,,"212, - 213, 2nd Floor, Food Court, Infiniti Mall, New Link Rd, Malad, Mindspace, Malad West, Mumbai, Maharashtra 400064",19.1848469,72.8345642,400064,Malad West,,TRUE,Infiniti Mall
,,,"Unit 05, Seawoods Station Rd, Sector 28, Seawoods, Navi Mumbai, Maharashtra 400706",19.0210288,73.0177402,400706,Navi Mumbai,,FALSE,
,,,"Mehboob Studios, St Sebastian Colony, Ranwar, Bandra West, Mumbai, Maharashtra 400050",19.0523549,72.8251229,400050,Bandra West,,FALSE,
,,,"F Wing, Dr Annie Besant Rd, Shiv Sagar Estate, Worli, Mumbai, Maharashtra 400018",18.9905278,72.8135081,400018,Worli,,FALSE,
,,,"5, Prema CHS, Lokhandwala complex, Main Rd, Lokhandwala Complex, Andheri West, Mumbai, Maharashtra 400053",19.1450972,72.8233145,400053,Andheri West,,TRUE,Lokhandwala Comples
,,,,,,,,,,
,Adidas,11,"Oberai Mall, shop no F01/02 1st floor, Oberoi Garden City, Western Express Hwy, Goregaon, Mumbai, Maharashtra 400063",19.173725,72.8605168,400063,Goregaon,,TRUE,Oberai
,,,"Dahisar Check Naka, 3B Shopping Commercial Bldg Orchid Ozone Off W.E. Highway Thakur Mall DB Reality, Mira Road, Mumbai, Maharashtra 401107",19.2629192,72.8743671,401107,,,FALSE,
,,,"Shop no 1&2, KL Regalia, Linking Rd, Khar West, Mumbai, Maharashtra 400052",19.0707222,72.8341641,400052,Khar West,,FALSE,
,,,"MAKER MAXITY, Jio World Drive Unit F12, First Floor, Bandra Kurla Complex, Mumbai, Maharashtra 400051",19.05339,72.8504402,400051,,,TRUE,Bandra Kurla Comples
,,,"Unit 109 1ST FLOOR Infiniti Mall Link Rd.Oshiwara.Anderi-West MUMBAI Maharashtra 400053 IN, New Link Rd, Mumbai, Maharashtra",19.1412127,72.8309064,400053,Anderi West,,TRUE,Infiniti Mall
,,,"Shop No. 225, 2nd Floor, Infiniti Mall, New Link Rd, Mindspace, Malad West, Mumbai, Maharashtra 400064",19.1848469,72.8345642,400064,Malad West,,TRUE,Infiniti Mall
,,,"Service Rd, Subhash Nagar, Thane West, Mumbai, Maharashtra 400606",19.2100354,72.9882368,400606,Thane West,,,
,,,"Shop.103 Big Mall, Ghodbunder Rd, Kasarvadavali, Thane West, Mumbai, Maharashtra 400615",19.2680252,72.9649103,400615,Thane West,,TRUE,Big Mall
,,,"Lal Bahadur Shastri Rd, Amrut Nagar, Ghatkopar West, Mumbai, Maharashtra 400086",19.0991894,72.9173925,400086,Ghatkopar West,,FALSE,
,,,"Ground Floor, Nawaz Mension, 25, Shahid Bhagat Singh Rd, Colaba, Mumbai, Maharashtra 400039",18.9234801,72.8318773,400039,Colaba,,FALSE,
,,,"HSP Parel Kids, Unit No - F-11B, Phoenix Mall Skyzone, Senapati Bapat Marg, Lower Parel West, Mumbai, Maharashtra 400013",18.9949809,72.8255004,400013,Lower Parel West,,FALSE,
,,,,,,,,,,
,Allen Solly,12,"Phoenix High Street, Senapati Bapat Marg, Mumbai - 400020",18.994744,72.8245993,400020,,,FALSE,
,,,"Shop No. F11, First Floor, Sky Zone Phoenix, Lower Parel, Mumbai - 400013",18.9948509,72.8252115,400013,Lower Parel,,FALSE,
,,,"Atria Mall, Worli, Mumbai - 400020",18.9910033,72.8143227,400020,Worli,,TRUE,Atria Mall
,,,"Shop No. G2, Grand Galleria, Phoenix High Street, Senapati Bapat Marg, Lower Parel, Mumbai - 400013",18.9950507,72.8241397,400013,Lower Parel,,FALSE,
,,,"Unit No. 7, Ramdas Sutrale Marg, Chandavarkar Road, Borivali, Mumbai - 400092",19.2323097,72.8535872,400092,Borivali,,FALSE,
,,,"F-13, First Floor, Oberoi Mall, Western Express Highway, Goregaon East, Mumbai - 400063",19.173725,72.8605168,400063,Goregaon East,,TRUE,Oberoi
,,,"Shop No. 15, Satara Park, Shimpoli Road, Near Gokhale School, Borivali West, Mumbai - 400092",19.2240288,72.8481451,400092,Borivali West,,FALSE,
,,,"S-Mart, Shop No-21/25, Wing A, Kasturi Plaza, Manpada Road, Dombivali- East, Mumbai - 421201",19.2150952,73.0904049,421201,Dombivali East,,FALSE,
,,,"GF 38 Viviana City Mall, Voltas Compound, Pokhran Road No. 2, Subhash Nagar, Mumbai - 400610",19.2196425,72.9597356,400610,,,TRUE,Viviana City Mall
,,,"Shreeji Collection, Lucky Palace, Near State Bank Of India Navghar, Vasai Road West, Mumbai - 401202",19.3822755,72.8328129,401202,,,FALSE,
,,,"Shop No. G4, Pheonix Market City Mall, L B S Marg, Kamani, Kurla, Mumbai - 400070",19.0863795,72.8889774,400070,Kurla,,TRUE,Market City Mall
,,,"G6, Ground Floor, Inorbit Mall, Sector 30A, Vashi, Mumbai - 400705",19.0657994,73.0009493,400705,Vashi,,TRUE,Inorbit Mall
,,,,,,,,,,
,American Eagle,1,"Phoenix Marketcity Mall, Lal Bahadur Shastri Road, Kurla West, Kamani, Mumbai, Maharashtra - 400070",19.0863795,72.8889774,400070,,,TRUE,Phoenix Marketcity Mall
,,,,,,,,,,
,AND,11,"Plot No 172, Bajaj Niwas, Linking Rd, Khar, Khar West, Mumbai, Maharashtra 400052",19.0687044,72.8337366,400052,,,FALSE,
,,,"Shop No. S-3, Second Floor, Oberoi Mall, Goregaon, Mumbai, Maharashtra 400063",19.1741226,72.8607225,400063,,,TRUE,Oberoi Mall
,,,"Shop No G - 14 & 15, Inorbit Rd, Malad, Mindspace, Malad West, Mumbai, Maharashtra 400064",19.171952,72.8356615,400064,,,FALSE,
,,,"FF- 51, First Floor, Phoenix Market City Mall, L.B.S., Lal Bahadur Shastri Marg, Kurla West, Mumbai, Maharashtra 400070",19.0862457,72.8892739,400070,,,TRUE,Phoenix Market City Mall
,,,"Ground Floor, Infiniti Mall,, New Link Rd, Andheri West, Mumbai, Maharashtra 400053",19.1412127,72.8309064,400053,,,TRUE,Infiniti Mall
,,,"Infiniti Mall - Malad,, Ground floor, Link Road, Malad-(W), Mumbai, Maharashtra 400064",19.1848469,72.8345642,400064,,,TRUE,Infiniti Mall - Malad
,,,"Akurli Rd, Kandivali, Akurli Industry Estate, Kandivali East, Mumbai, Maharashtra 400101",19.2015267,72.8590461,400101,,,FALSE,
,,,"No.29, Satra Park, Shimpoli Road, Borivali West, Mumbai, Maharashtra 400092",19.2237752,72.8484955,400092,,,FALSE,
,,,"Extension of Entry Rd to Phoenix, Lower Parel, Mumbai, Maharashtra 400013",18.993734,72.8243796,400013,,,FALSE,
,,,"Ground Floor, Inorbit Mall, Sector No.30A, Vashi, Navi Mumbai, Maharashtra 400705",19.0657994,73.0009493,400705,Navi Mumbai,,TRUE,Inorbit Mall
,,,,,,,,,,
,Anita Dongre,2,"Ground Floor, Everest Classic Building, Linking Rd, Khar West, Mumbai, Maharashtra 400052",19.0731595,72.8338741,400052,,,FALSE,
,,,"Senapati Bapat Marg, Lower Parel, Mumbai, Maharashtra 400013",18.9999654,72.828525,400013,,,FALSE,
,,,,,,,,,,
,Arrow,13,"Shop No. 1 & 4, SaiLeela Commercial Bldg., S. V. Road, Borivali (West), Mumbai - 400092",19.2260079,72.8551191,400092,Borivali (West),,FALSE,
,,,"Sea Castle, 29, Dr NA PurandareMarg, Chowpatty, Mumbai - 400007",18.9560903,72.8126854,400007,Chowpatty,,FALSE,
,,,"Shop No. 19, Cusrow Baugh, Colaba, Mumbai - 400001",18.9198007,72.829618,400001,Colaba,,FALSE,
,,,"S- Mart, Shop No. 9, Kasturi Plaza, Manpada Road, Dombivali East, Mumbai - 421201",19.2151163,73.0905281,421201,Dombivali East,,FALSE,
,,,"F-03, First Floor, Oberoi Mall Pvt. Ltd., International Business Park, Oberoi Garden City, Off Western Express Highway, Goregaon (East), Mumbai - 400063",19.173725,72.8605168,400063,Goregaon (East),,TRUE,Oberoi Mall Pvt. Ltd.
,,,"G 16, Growels 101 mall, Akurli Road, Kandivli (East), Mumbai - 400101",19.2033444,72.8595734,400101,Kandivli (East),,TRUE,
,,,"117 First Floor - Infiniti Mall, Infiniti Malad, Link Road, Malad West, Mumbai - 400064",19.1848469,72.8345642,400064,Malad West,,TRUE,117 First Floor - Infiniti Mall
,,,"Mindspace, F -44, Inorbit Mall, Link Road, Malad West, Mumbai - 400064",19.1729281,72.8359056,400064,Malad West,,TRUE,Inorbit Mall
,,,"Shop No : 2&3, Anand Villa Co-Operating Housing Society, Plot No - 65-Z, Next to Arya Samaj, Linking Road, Santacruz (West), Mumbai - 400054",19.0791537,72.8342338,400054,Santacruz (West),,FALSE,
,,,"F-25, 1st Floor, Korum Mall, Pondey Road, Eastern Express Highway, Thane West - 400609",19.2028031,72.9653798,400609,Eastern Express Highway,,TRUE,Korum Mall
,,,"Shop No. 2, Maruti Bhavan, Ram Maruti Road, Thane, Mumbai - 400602",19.1898022,72.9723381,400602,Thane,,FALSE,
,,,"Centre One Shopping Mall, Plot No. 33, Sector 30 A, Vashi, Navi Mumbai - 400705",19.0671636,72.9985555,400705,Vashi,,TRUE,Centre One Shopping Mall
,,,"Shop No. 6, First Floor, No 30/A, Inorbit Mall, Vashi, Navi Mumbai - 400705",19.0657994,73.0009493,400705,Vashi,,TRUE,Inorbit Mall
,,,,,,,,,,
,BATA,12,"250, Bandra Linking Road, Kanaiya Building, Bandra, 400050",19.0627702,72.8350928,400050,Bandra,,FALSE,
,,,"51, Hill Road, Bandra (West), 400050",19.0559327,72.8345131,400050,Bandra (West),,FALSE,
,,,"17 And 18, Mirza Ghalib Marg, Byculla Bridge, Byculla, 400008",18.970656,72.8317165,400008,Byculla,,FALSE,
,,,"Plot 1a, Chemburkar Marg, Chembur, 400071",19.051177,72.894363,400071,Chembur,,FALSE,
,,,"Bismilla Building, Opposite Railway Station, Dadar, 400028",19.019678,72.841993,400028,Dadar,,FALSE,
,,,"Shop G-19b, R City Mall, Ghatkoper, 400086",19.0996854,72.9163939,400086,Ghatkoper,,TRUE,R City Mall
,,,"Ground Floor, Metro Junction Mall, Netivalli, Kalyan, 421336",19.2296376,73.1234003,421336,Kalyan,,TRUE,Metro Junction Mall
,,,"Sahakar Building, Station Road, Kurla (West), 400070",19.0662431,72.8788669,400070,Kurla (West),,FALSE,
,,,"P-314, Victoria Church, L J Road, Opposite Victoria Church, Mahim, 400016",19.0345513,72.8421586,400016,Mahim,,FALSE,
,,,"354, Matunga Mansion, 400019",19.0277101,72.8528684,400019,Matunga Mansion,,FALSE,
,,,"Shop 3 And 4, Santoshi Mata Chc Ltd, Mumbai Central, 400008",18.967126,72.819775,400008,Mumbai Central,,FALSE,
,,,"Jahangir Building, Dr Mascarenhas Road, Mazgaon, 400010",18.9711328,72.8407069,400010,Mazgaon,,FALSE,
,,,,,,,,,,
,Biba,9,"Shop 10, Ground Floor, Link Road, Infinity Mall, Andheri (West), 400001",19.1412127,72.8309064,400001,Andheri (West),,TRUE,Infinity Mall
,,,"G-31, Runwal City, R Mall, Lbs Marg, Ghatkopar (West), 400086",19.1840208,72.9513545,400086,Ghatkopar (West),,TRUE,R Mall
,,,"Shop S-28, 2nd Floor, Western Eastern Highway, Oberai Mall, Goregaon (East), 400067",19.173725,72.8605168,400067,Goregaon (East),,TRUE,Oberai Mall
,,,"Biba Apparels Private Limited, Western Express Highway, Nirlon Compound, Goregaon (East), 400069",19.15242,72.8565793,400069,Goregaon (East),,FALSE,
,,,"Shop 110, Behind Poiser Bus Depot, Raghuleela Mall, Kandivali, 400067",19.2133712,72.8491592,400067,Kandivali,,TRUE,Raghuleela Mall
,,,"Shop 12-13, Lbs Marg, Huma Adlabs, Kanjurmarg",19.1197659,72.9256229,urmarg,Huma Adlabs,,FALSE,
,,,"356, Ram Janaki, Linking Road, Khar (West), 400052",19.0698035,72.8334973,400052,Khar (West),,FALSE,
,,,"Phoenix Mill Compound, Phoenix Galleria, Lower Parel, 400018",18.9893218,72.8253312,400018,Lower Parel,,FALSE,
,,,"Unit Ff/13, 1near Goregaon Sports Club, Biba Store, Infiniti Malad, Malad Link Road, 400061",19.1822783,72.8350283,400061,Malad Link Road,,FALSE,
,,,,,,,,,,
,Calvin Klein,6,"2nd Floor,Shop No. S-6, Palladium Mall,High Street Phoenix, 462, Senapati Bapat Marg, Mumbai, Maharashtra 400013",18.994744,72.8245993,400013,,,TRUE,Palladium Mall
,,,"G24,Infiniti Mall, Mindspace, Malad West, Mumbai, Maharashtra 400064",19.1848469,72.8345642,400064,,,TRUE,Infiniti Mall
,,,"Palm Lands, Dr Ambedkar Rd, Khar West, Mumbai, Maharashtra 400050",19.0618426,72.8296914,400050,,,FALSE,
,,,"Unit UG - 23, Unit UG, 23, Lal Bahadur Shastri Rd, Kamani, Kurla West, Kurla, Mumbai, Maharashtra 400070",19.0869923,72.8897252,400070,,,FALSE,
,,,"SHOP NO. 8, H Kantilal Compound, Andheri - Kurla Rd, OPP MCDONALS, Sag Baug, Marol, Saki Naka, Mumbai, Maharashtra 400072",19.1063234,72.8851756,400072,,,FALSE,
,,,"Ground Floor -01, Oberoi Mall, Western Express Hwy, Goregaon, Mumbai, Maharashtra 400063",19.173725,72.8605168,400063,,,TRUE,Oberoi Mall
,,,,,,,,,,
,Crocs,6,"F-122, Neptune Mall, LBS Marg, Bhandup West, Mumbai - 400083",19.1417111,72.9314305,400083,Bhandup West,,TRUE,Neptune Mall
,,,"F-64, R City Mall, LBS Marg, Ghatkopar West, Mumbai - 400086",19.0996854,72.9163939,400086,Ghatkopar West,,TRUE,R City Mall
,,,"Shop No-F-35, 1st Floor, Oberoi Mall, Goragaon East, Mumbai - 400063",19.173725,72.8605168,400063,Goragaon East,,TRUE,Oberoi Mall
,,,"G-10, Phoenix Market City, Kamani Junction, LBS Marg, Kurla West, Mumbai - 400070",19.0863795,72.8889774,400070,Kurla West,,FALSE,
,,,"Shop No-18B, G/F, High Street Phoenix, Senapati Bapat Marg, Lower Parel, Mumbai - 400013",18.994744,72.8245993,400013,Lower Parel,,FALSE,
,,,"SF-223, Infiniti Mall, Link Road, Malad West, Mumbai - 400064",19.1848469,72.8345642,400064,Malad West,,TRUE,Infiniti Mall
,,,,,,,,,,
,Fabindia,16,"No. 2 & 4, Navroze, 66 Pali Hill, Bandra (West), Mumbai - 400050",19.0658356,72.8282461,400050,Bandra (West),,FALSE,
,,,"Unit No. 3 B, K-Star Mall, Diamond Garden, Chembur, Mumbai",19.0523708,72.901627,,Chembur,,TRUE,K-Star Mall
,,,"R- City Centre, Shop no. S-39 2nd floor, L. B. S. Marg, Ghatkopar (W), Mumbai - 400086",19.0996854,72.9163939,400086,Ghatkopar (W),,FALSE,
,,,"M/s. Oberoi Mall Private Ltd.S-25, Second Floor, Oberoi Garden City, Off. Western Express Highway, Goregaon (East), Mumbai - 400063",19.173725,72.8605168,400063,Goregaon (East),,TRUE,M/s. Oberoi Mall Private Ltd.S-25
,,,"Jeroo Building, 137, M.G. Road, Kala Ghoda, Colaba, Mumbai - 400001",18.9286988,72.8316811,400001,Colaba,,FALSE,
,,,"Noble House Junction of Khar Danda, 18th Road, Khar (West), Mumbai - 400052",19.0735345,72.8294797,400052,Khar (West),,FALSE,
,,,"Phoenix Marketcity, Unit No. F-77, First Floor, L.B.S. Road, Kurla (W), Mumbai - 400070",19.0863795,72.8889774,400070,Kurla (W),,FALSE,
,,,"Unit No.13, Grand Galleria, Phoenix Mills Compound,462, Senapati Bapat Marg, Lower Parel, Mumbai - 400013",18.994744,72.8245993,400013,Lower Parel,,FALSE,
,,,"F-2, First Floor, Inorbit Mall, Link Road, Mind Space, Malad (West), Mumbai - 400064",19.1729281,72.8359056,400064,Malad (West),,TRUE,Inorbit Mall
,,,"FF120, First Floor, Infiniti Malad, Link Road, Malad (West), Mumbai - 400064",19.1848469,72.8345642,400064,Malad (West),,FALSE,
,,,"S-109 / 218, B Wing, Nirmal Lifestyles,LBS Marg, Mulund (West), Mumbai - 400080",19.0846131,72.8839713,400080,Mulund (West),,FALSE,
